{
  "schema_version": 1,
  "evidence_class": "local_simulated_qualification",
  "scenario": "simulated regional data-service loss and ordered recovery",
  "environment": "local-minikube-simulation",
  "canadian_region": "ca-central-1-simulated",
  "authorized_by": ["fixture-platform-owner", "fixture-safety-reviewer"],
  "started_at": "2026-07-22T12:00:00Z",
  "failure_detected_at": "2026-07-22T12:00:08Z",
  "recovery_declared_at": "2026-07-22T12:00:20Z",
  "useful_service_restored_at": "2026-07-22T12:04:20Z",
  "last_durable_fact_at": "2026-07-22T11:59:55Z",
  "recovered_through_at": "2026-07-22T11:59:55Z",
  "rpo_target_seconds": 300,
  "rto_target_seconds": 900,
  "measured_rpo_seconds": 5,
  "measured_rto_seconds": 260,
  "restore_steps": [
    { "order": 1, "component": "network-dns-time-kms", "completed_at": "2026-07-22T12:00:40Z", "evidence_digest": "1111111111111111111111111111111111111111111111111111111111111111" },
    { "order": 2, "component": "identity-pki-revocation", "completed_at": "2026-07-22T12:01:00Z", "evidence_digest": "2222222222222222222222222222222222222222222222222222222222222222" },
    { "order": 3, "component": "audit-evidence-object-manifests", "completed_at": "2026-07-22T12:01:30Z", "evidence_digest": "3333333333333333333333333333333333333333333333333333333333333333" },
    { "order": 4, "component": "context-databases-migrations", "completed_at": "2026-07-22T12:02:20Z", "evidence_digest": "4444444444444444444444444444444444444444444444444444444444444444" },
    { "order": 5, "component": "broker-paused-quarantine", "completed_at": "2026-07-22T12:02:40Z", "evidence_digest": "5555555555555555555555555555555555555555555555555555555555555555" },
    { "order": 6, "component": "read-projections", "completed_at": "2026-07-22T12:03:10Z", "evidence_digest": "6666666666666666666666666666666666666666666666666666666666666666" },
    { "order": 7, "component": "owning-context-apis", "completed_at": "2026-07-22T12:03:35Z", "evidence_digest": "7777777777777777777777777777777777777777777777777777777777777777" },
    { "order": 8, "component": "gateway-read-traffic", "completed_at": "2026-07-22T12:03:55Z", "evidence_digest": "8888888888888888888888888888888888888888888888888888888888888888" },
    { "order": 9, "component": "command-traffic-after-current-authority", "completed_at": "2026-07-22T12:04:20Z", "evidence_digest": "9999999999999999999999999999999999999999999999999999999999999999" }
  ],
  "authority_controls": { "recovery_epoch_incremented": true, "expired_grants_rejected": true, "leases_invalidated": true, "fresh_authority_required": true, "command_traffic_enabled_after_reconciliation": true },
  "message_controls": { "consumers_restored_paused": true, "facts_replayed_idempotently": true, "commands_quarantined": true, "blind_command_replay": false, "duplicate_physical_effects": 0 },
  "integrity": { "backup_digest_verified": true, "tenant_scope_verified": true, "gaps_reconciled": true, "audit_preserved": true },
  "result": "pass",
  "limitations": ["Local deterministic simulation only; no cloud provider, managed KMS/HSM, production dataset, or production RPO/RTO claim."]
}
